{"command":["scripts/run_all_tests.sh","--profile","release","--release-report-out","/private/tmp/sifr-phase40-candidate-rebuild.s49VOp/release-output-pass8/release-profile-report.json"],"overall_status":"pass","profile":{"expanded_selected_areas":[{"area":"algorithmic_compatibility","suites":["representative-subset","taxonomy-smoke"]},{"area":"core_language","suites":["cfg_flow_behaviors","hir_analysis_behaviors","integer_dtype_rules","syntax_parser_lexer_matrix"]},{"area":"coverage_matrix","suites":["readiness"]},{"area":"cpython_differential","suites":["generated_broader","hand_seeded_merge","policy"]},{"area":"developer_tooling","suites":["editor-release","full"]},{"area":"diagnostics","suites":["baselines","rules"]},{"area":"distribution_release","suites":["epoch-bootstrap","evidence-custody","full","incident-governance","protected-drill","qualification","stable-prepare","stable-publication","stable-publish-primitives"]},{"area":"documentation","suites":["ga-release","structure"]},{"area":"ecosystem_compatibility","suites":["ecosystem-broader","oss-curated"]},{"area":"fuzz_property","suites":["fuzz-smoke","property"]},{"area":"generated_code_quality","suites":["release-full"]},{"area":"package_management","suites":["offline-integration"]},{"area":"performance","suites":["full"]},{"area":"project_workspace","suites":["baselines","frontend_mode_parity","project_graph_isolation"]},{"area":"python_interop","suites":["arrow-cpython311","arrow-examples","async-context-examples","async-declaration-examples","binding-authoring","buffer-cpython311","buffer-examples","callback-examples","callbacks","cloud-boto3","dataframe-examples","dataframes","dlpack-cpython311","dlpack-examples","env","libraries","lsp-declaration-authoring","ml","readonly-check-doctor","scaffold","self-test","tier1","tier2","tier3","tier4"]},{"area":"regression","suites":["crashes","fixedbugs"]},{"area":"runtime_platform","suites":["platform-evidence","platform-golden","platform-support-matrix","sanitizer-full"]},{"area":"rust_interop","suites":["compatibility-matrix","matrix","stable-candidate","stale-drafts","tiers"]},{"area":"stdlib_parity","suites":["module-full-check"]},{"area":"sysroot_release","suites":["host-installed-smoke","host-installed-stdlib-heavy"]}],"manifest_sha256":"fa3d95c04f8abdcbd76a18d2c72dac47aca5356266188fc44ca5701f689d8ec7","name":"release"},"report_id":"release-c9d611fb7c7c-fa3d95c04f8a","result_artifacts":[{"path":"target/verification/areas/developer-tooling-release-results.json","sha256":"5dd4ffdc4f29aa90e875252e6d2771b2b8fa81acc5b9c194bfb726cd8218da1f"},{"path":"target/verification/areas/distribution-release-release-results.json","sha256":"0438b88b0b8302680f49d26a249869a69530a30ac8dc989329c6558af3df2ad4"},{"path":"target/verification/areas/documentation-release-results.json","sha256":"a7cd2e048e41ca8c665144992aed5d882385de46027e8d0f6ad0fc3eab4a50a4"},{"path":"target/verification/areas/rust-interop-release-results.json","sha256":"95176b5937b4ed0e1c9843ef6c3896969f6336431bc8a0d08350cc2db9b9555e"}],"schema_version":2,"source":{"clean":true,"commit":"c9d611fb7c7c5d05421d784d53a2b78c1a7dcae9","submodules":{"editor_integrations":"d7577d49274b97fdf508b7fa16b6d9bdb51b4acd","editor_integrations/vscode":"273fd5d3ebc958124c3151647e2b61136a3ddb06","third_party/ruff":"e024f2a4870568734a3b215226570aab87e396a2","verification/areas/algorithmic_compatibility/corpora/leetcode":"a20d9d5020dae9c19913a598d262ab931924cfe9","verification/areas/developer_tooling/corpora/sifr-large-lsp-verification":"0d26e732fee734806159610e05a33dd6d4d9bed7","verification/areas/package_management/corpora/demo_repositories/sifr-demo-app":"3a9e2ef3bb648125f9be7cc538722be537cbb7f0","verification/areas/package_management/corpora/demo_repositories/sifr-demo-http":"4a9128427fb4f87bf4fbc8f499a00e96eb24a021","verification/areas/package_management/corpora/demo_repositories/sifr-demo-json":"8eca97bbf83c5f986505ed980acf2c1f458cbacf","verification/areas/package_management/corpora/demo_repositories/sifr-demo-test-support":"e8a1f5f9b1e4ffad12fdbd656b2d68d8b7fd13fb","verification/areas/package_management/corpora/demo_repositories/sifr-demo-workspace":"13586edda82d0ed2e0bec487c10228af22d41e48"},"unresolved":false},"steps":[{"elapsed_ms":597,"name":"cargo_cache_setup","status":"pass","suite_results":[]},{"elapsed_ms":8037,"name":"coverage_matrix_checks","status":"pass","suite_results":[]},{"elapsed_ms":30759,"name":"core_guardrails","status":"pass","suite_results":[]},{"elapsed_ms":7502,"name":"diagnostic_rules","status":"pass","suite_results":[]},{"elapsed_ms":47668,"name":"cpython_differential","status":"pass","suite_results":[]},{"elapsed_ms":515737,"name":"python_interop","status":"pass","suite_results":[]},{"elapsed_ms":6048,"name":"rust_interop_checks","status":"pass","suite_results":[{"area":"rust_interop","case_ids":["area-check","area-check-self-test"],"result_artifact_sha256":"95176b5937b4ed0e1c9843ef6c3896969f6336431bc8a0d08350cc2db9b9555e","status":"pass","suite":"matrix"},{"area":"rust_interop","case_ids":["area-check","area-check-self-test"],"result_artifact_sha256":"95176b5937b4ed0e1c9843ef6c3896969f6336431bc8a0d08350cc2db9b9555e","status":"pass","suite":"tiers"},{"area":"rust_interop","case_ids":["area-check","area-check-self-test"],"result_artifact_sha256":"95176b5937b4ed0e1c9843ef6c3896969f6336431bc8a0d08350cc2db9b9555e","status":"pass","suite":"compatibility-matrix"},{"area":"rust_interop","case_ids":["area-check","area-check-self-test"],"result_artifact_sha256":"95176b5937b4ed0e1c9843ef6c3896969f6336431bc8a0d08350cc2db9b9555e","status":"pass","suite":"stale-drafts"},{"area":"rust_interop","case_ids":["area-check","area-check-self-test"],"result_artifact_sha256":"95176b5937b4ed0e1c9843ef6c3896969f6336431bc8a0d08350cc2db9b9555e","status":"pass","suite":"stable-candidate"}]},{"elapsed_ms":1038,"name":"frontend_syntax_guardrails","status":"pass","suite_results":[]},{"elapsed_ms":90226,"name":"developer_tooling_checks","status":"pass","suite_results":[{"area":"developer_tooling","case_ids":["static:tooling-rules-lock","static:tooling-rules-lock-self-test","static:tooling-dependency-boundaries","static:tooling-dependency-boundaries-self-test","static:lsp-split-brain","static:lsp-split-brain-self-test","static:linter-diagnostic-class","static:linter-diagnostic-class-self-test","static:rule-suppression-rules","static:rule-suppression-rules-self-test","static:completion-quality","static:completion-quality-self-test","formatter:formatter-rules","formatter:formatter-rules-self-test","formatter:formatter-rules-manifests","formatter:formatter-rules-manifests-self-test","formatter:formatter-ast-coverage","formatter:formatter-ast-coverage-self-test","analysis:analysis-snapshot-rules","analysis:analysis-snapshot-rules-self-test","analysis:analysis-snapshot-coherence","analysis:analysis-snapshot-coherence-self-test","analysis:analysis-split-brain","analysis:analysis-split-brain-self-test","analysis:tooling-parity","analysis:tooling-parity-self-test","lsp-smoke:lsp-protocol-smoke","lsp-smoke:lsp-protocol-smoke-self-test","lsp-smoke:lsp-marker-corpus","lsp-smoke:lsp-marker-corpus-self-test","lsp-smoke:lsp-transcript-replay","lsp-smoke:lsp-transcript-replay-self-test","lsp-semantic-editor:lsp-semantic-editor","lsp-semantic-editor:lsp-semantic-editor-self-test","lsp-stress:lsp-protocol-stress","lsp-stress:lsp-protocol-stress-self-test","lsp-stress:large-lsp-submodule","lsp-stress:large-lsp-corpus-check","lsp-stress:large-lsp-session-self-test","lsp-stress:large-lsp-session-smoke","tooling-readiness:tooling-readiness","tooling-readiness:tooling-readiness-self-test"],"result_artifact_sha256":"5dd4ffdc4f29aa90e875252e6d2771b2b8fa81acc5b9c194bfb726cd8218da1f","status":"pass","suite":"full"},{"area":"developer_tooling","case_ids":["editor-release:vscode-extension-rules","editor-release:vscode-extension-rules-self-test","editor-release:vscode-extension","editor-release:vscode-extension-self-test","editor-release:editor-assets","editor-release:editor-assets-self-test"],"result_artifact_sha256":"5dd4ffdc4f29aa90e875252e6d2771b2b8fa81acc5b9c194bfb726cd8218da1f","status":"pass","suite":"editor-release"}]},{"elapsed_ms":730,"name":"documentation_checks","status":"pass","suite_results":[{"area":"documentation","case_ids":["structure"],"result_artifact_sha256":"a7cd2e048e41ca8c665144992aed5d882385de46027e8d0f6ad0fc3eab4a50a4","status":"pass","suite":"structure"},{"area":"documentation","case_ids":["ga-release"],"result_artifact_sha256":"a7cd2e048e41ca8c665144992aed5d882385de46027e8d0f6ad0fc3eab4a50a4","status":"pass","suite":"ga-release"}]},{"elapsed_ms":705236,"name":"performance_budget_checks","status":"pass","suite_results":[]},{"elapsed_ms":262,"name":"verification_hardening_self_tests","status":"pass","suite_results":[]},{"elapsed_ms":199,"name":"verification_runner_foundation","status":"pass","suite_results":[]},{"elapsed_ms":0,"name":"fuzz_property_checks","status":"pass","suite_results":[]},{"elapsed_ms":16282,"name":"algorithmic_compatibility_checks","status":"pass","suite_results":[]},{"elapsed_ms":232407,"name":"distribution_validation","status":"pass","suite_results":[{"area":"distribution_release","case_ids":["artifact_broken_sysroot_archives_rejected","artifact_checksum_mismatch_rejected","artifact_configures_path","artifact_generated_installer_all_preview_targets","artifact_install_version_state","artifact_missing_target_rejected","artifact_no_modify_path_respected","artifact_self_update_receipt_rules","artifact_sha256_validated","artifact_stable_candidate_generation","artifact_target_mismatch_rejected","channel_dispatcher_points_to_generated_installer","channel_metadata_dispatcher_drift_rejected","channel_metadata_generated","channel_metadata_installer_agreement","channel_metadata_installer_drift_rejected","channel_metadata_missing_installer_rejected","channel_metadata_stable_active","create_new_version_active_site_dispatchers","create_new_version_alpha_dry_run","create_